HabilityId,HabilityName,Effect
296,prioridad,La extrana cola que le envuelve la cabeza impide al rival usar movimientos con prioridad contra el y sus aliados.
297,tipo tierra,"Si lo alcanza un movimiento de tipo tierra, recupera PS en vez de sufrir dano."
298,,"El Pokemon siempre actua con lentitud cuando usa movimientos de estado, pero estos no se ven afectados por la habilidad del objetivo."
299,PS,"Al entrar en combate, restaura algunos PS de su aliado como muestra de hospitalidad."
300,tipo fantasma,Alcanza a Pokemon de tipo fantasma con movimientos de tipo normal o lucha. Su precision no se puede reducir e ignora los cambios en la evasion del objetivo.
301,mascara turquesa,"Al evocar viejos recuerdos, el Pokemon hace brillar la mascara turquesa y aumenta su velocidad."
302,mascara horno,"Al evocar viejos recuerdos, el Pokemon hace brillar la mascara horno y aumenta su ataque."
303,mascara fuente,"Al evocar viejos recuerdos, el Pokemon hace brillar la mascara fuente y aumenta su defensa especial."
304,mascara cimiento,"Al evocar viejos recuerdos, el Pokemon hace brillar la mascara cimiento y aumenta su defensa."
305,envenenar gravemente,"Gracias al poder de su cadena impregnada de toxinas, puede envenenar gravemente al Pokemon al que ataque."
306,evasion,"Al entrar en combate por primera vez, esparce un aroma dulzon a nectar que reduce la evasion del rival."
307,,"Al entrar en combate, adopta la Forma Teracristal tras absorber la energia de su alrededor."
308,PS,"Su caparazon encierra energia de todos los tipos. Gracias a ello, si sus PS estan al maximo, el movimiento que lo alcance no sera muy eficaz."
309,Terapagos,"Cuando Terapagos adopta la Forma Astral, anula todos los efectos del tiempo atmosferico y de los campos que haya en el terreno gracias a su poder oculto."
310,Pecharunt,Los rivales que Pecharunt envenene con sus movimientos tambien sufriran confusion.
